product_url,product_id,product_title,product_rating,nbr_reviews,current_price,old_price,discount_percentage
https://www.etsy.com/fr/listing/1023297741/pas-tous-ceux-qui-errent-sont-lost,1023297741,Pas tous ceux qui errent sont lost compass brodé sac à main en toile de coton,4.9153,344,,,
https://www.etsy.com/fr/listing/1676005890/bundle-retro-de-gentillesse-svg-png-svg,1676005890,"Bundle rétro de gentillesse Svg Png, Svg d'affirmations positives, Svg de gentillesse, être gentil dessins svg, Svg de motivation rétro, chemises à la mode rétro svg",4.8777,14200,1.89,3.78,50.0
https://www.etsy.com/fr/listing/1875121418/hot-chocolate-time-vintage-inspired,1875121418,"Hot Chocolate Time Vintage-inspired Christmas Tote / Gift for Holidays, Mothers Day, Christmas, Great for Holiday Shopping",4.8276,32,,,
https://www.etsy.com/fr/listing/1062143361/torrey-fourre-tout-video-et-motif,1062143361,Torrey fourre-tout vidéo et motif,4.8851,826,,,
https://www.etsy.com/fr/listing/4301002881/lot-de-50-maquettes-de-sac-fourre-tout,4301002881,"Lot de 50 maquettes de sac fourre-tout, maquette de sac fourre-tout Photoshop, maquette de sac fourre-tout AOP, maquette de sac fourre-tout à bracelet noir, maquette de sac fourre-tout naturel",4.9093,9600,3.47,3.85,10.0
https://www.etsy.com/fr/listing/1486511192/sac-fourre-tout-ordinateur-cosmique-sac,1486511192,"Sac fourre-tout ordinateur cosmique - sac shopping 34 x 38 cm, esthétique numérique y2k, joli sac kawaii, sac fourre-tout rose, sac sur le thème de l'espace, sac fourre-tout original",4.981,6100,19.43,24.29,20.0
https://www.etsy.com/fr/listing/685812605/shopper-violet-avec-dentelle-sac-fourre,685812605,"Shopper violet avec dentelle, sac fourre-tout avec dentelle, sac à bandoulière violet, sac violet avec dentelle, shopper en tissu de coton solide et dentelle",4.9048,670,26.39,43.99,40.0
https://www.etsy.com/fr/listing/4300930325/lot-de-maquette-de-sac-fourre-tout-en,4300930325,"Lot de maquette de sac fourre-tout en toile, maquette de sac fourre-tout en toile naturelle, maquette de sac fourre-tout blanc, maquette de sac fourre-tout naturel, maquette de sac fourre-tout en toile",4.9093,9600,3.47,3.85,10.0
https://www.etsy.com/fr/listing/1671441969/tote-bag-brode-girl-power-o-sac-fourre,1671441969,"Tote bag brodé ""Girl Power"" | Sac fourre tout personnalisé",4.9079,237,,,
https://www.etsy.com/fr/listing/1675485644/bundle-png-boho-mom-life-svg-blessed,1675485644,"Bundle Png Boho Mom life Svg, Blessed Mama svg, Svg drôle de maman, beauté maman amour citations Svg, Svg maman tendance, Svg maman inspirante",4.8777,14200,1.89,3.78,50.0
https://www.etsy.com/fr/listing/1825665665/clipart-svg-png-de-chien-chihuahua,1825665665,Clipart SVG PNG de chien chihuahua : illustration de mignon chihuahua en téléchargement numérique pour travaux manuels et imprimables,5.0,79,1.84,3.68,50.0
https://www.etsy.com/fr/listing/1005107697/sac-de-marche-en-toile-de-coton-brode,1005107697,Sac de marché en toile de coton brodé Cat’s Out of the Bag.,4.9153,344,,,
https://www.etsy.com/fr/listing/1873653120/modeles-populaires-de-sacs-fourre-tout,1873653120,Modèles populaires de sacs fourre-tout chrétiens PNG Désert bohème PNG aquarelle croix Clipart coup de pinceau esthétique Png Mon péché était grand modèles de t-shirts,4.9766,1900,4.31,10.78,60.0
https://www.etsy.com/fr/listing/4397850180/carte-de-tarot-bundle-png-dark-romance,4397850180,"Carte de tarot BUNDLE png, Dark Romance Book Club PNG, mignon design livresque tendance pour autocollants, chemises, signets, tasses, sacs fourre-tout",4.991,324,5.26,8.09,35.0
https://www.etsy.com/fr/listing/4398547133/carte-de-tarot-bundle-png-dark-romance,4398547133,"Carte de tarot BUNDLE png, Dark Romance Book Club PNG, mignon design livresque tendance pour autocollants, chemises, signets, tasses, sacs fourre-tout",4.991,324,5.26,8.09,35.0
https://www.etsy.com/fr/listing/4351504866/bundle-png-de-noel-tendance-noel-preppy,4351504866,"Bundle PNG de Noël tendance, Noël preppy PNG, chemise de vacances en détresse rétro design joyeux et lumineux, sublimation d'impression de vibrations de Noël",4.9887,912,2.99,4.0,25.0
https://www.etsy.com/fr/listing/1871461234/boho-floral-mama-png-elle-est-maman-png,1871461234,"Boho Floral Mama PNG, elle est maman PNG, fête des mères Png, Christian Mama Png, Floral printemps Png, verset de la Bible Png, maman fleurs sauvages Png Coquette",4.9521,7000,3.24,6.47,50.0
https://www.etsy.com/fr/listing/1740656296/sublimation-de-vache-des-highlands,1740656296,"Sublimation de vache des Highlands canadiennes, clipart png de vache mignonne, amour Canada conception patriotique drôle de vache des Highlands, drapeau canadien PNG, fête du Canada",4.9718,168,1.07,4.28,75.0
https://www.etsy.com/fr/listing/1661589607/chapeau-de-cowboy-en-cuir-verres-wrap-20,1661589607,"Chapeau de cowboy en cuir, verres wrap 20, sublimation fine, cuir repoussé png, verres png, papiers peints western, verres floraux png",4.914,250,,,
https://www.etsy.com/fr/listing/1851622578/motherhood-png-distressed-retro-mama-png,1851622578,Motherhood PNG Distressed Retro Mama PNG Mom Spring Png Mothers Day Png Easter PNG Summer Png,4.8724,2600,2.39,3.19,25.0
https://www.etsy.com/fr/listing/1736399890/automne-coquette-png-thanksgiving-png,1736399890,"Automne Coquette PNG, Thanksgiving png, Coquette, automne png, PNG esthétique, design tendance automne, dessins Dtf png, tendance 3 x 3 png, Soft Girl Era,",4.9926,268,2.56,4.27,40.0
https://www.etsy.com/fr/listing/4296961491/god-bless-america-png-4th-of-july,4296961491,God Bless America PNG 4th of July Sublimation Designs Patriotic DTF Transfers Fourth of July Shirt Png Tote Bag Png Memorial Day Tshirts,4.9766,1900,4.31,10.78,60.0
https://www.etsy.com/fr/listing/1405388782/fichier-de-conception-png-svg-a-la-mode,1405388782,"Fichier de conception PNG SVG à la mode en téléchargement, OK pour ralentir, Svg de santé mentale, autocollants mignons, conception de sublimation esthétique rétro",4.9851,1100,3.18,5.78,45.0
https://www.etsy.com/fr/listing/1485836625/telechargement-numerique-6-svg-png,1485836625,"Téléchargement numérique 6 SVG PNG Design Bundle, citations motivantes pour les autocollants, affirmations inspirantes sur la santé mentale, fichiers de sublimation mignons",4.9851,1100,7.86,14.29,45.0
