product_id,product_title,old_price,discount_percentage,now_price,currency,listed_date,product_url,product_description,product_variation
4301871513,"Sac fourre-tout en toile personnalisé, sac fourre-tout LOGO personnalisé, sac fourre-tout prénom, sac cadeau de demoiselle d'honneur, brodé avec initiales fourre-tout personnalisé, cadeau personnalisé",,,0.26,USD,,https://www.etsy.com/listing/4301871513/custom-canvas-tote-bagpersonalised-logo,"Sacs fourre-tout personnalisés | Votre parfait compagnon de fête !✨
Bienvenue dans notre boutique. Nous fabriquons à la main une variété de cadeaux personnalisés. Si vous êtes toujours à la recherche des articles de fête parfaits, vous êtes au bon endroit, nous sommes sûrs que vous trouverez quelque chose de spécial ici :)

Nos sacs fourre-tout personnalisés fabriqués artisanalement allient fonctionnalité et charme personnalisé - parfaits pour les anniversaires, les mariages ou pour une élégance de tous les jours. Chaque pièce est fabriquée à la main avec amour pour raconter votre histoire unique.

Pourquoi vous allez adorer :

Qualité supérieure : toile durable + doublure en polyester lisse (facile à nettoyer !).

Adapté à vos besoins : choisissez le texte à broder + une étiquette volante ou un ruban gratuit (ajoutez votre sélection dans les commentaires lors du paiement !).

Détails bien pensés : fermeture à glissière sécurisée + poignées renforcées pour une utilisation durable.

Options de cadeaux gratuits (1 par sac au choix) :

Étiquettes volantes : rondes, carrées ou étiquette nominative

Ruban : ruban imprimé (lettre et couleur fixes) ou ruban ordinaire

Offre spéciale en gros :
Pour toute commande de 10 sacs fourre-tout ou plus, vous recevrez également un éventail gratuit par sac !

📐 Proportions parfaites (mesurées à la main) :
Taille du sac fourre-tout (M et L) :
Taille M :
Largeur du bas : 13,4 pouces/34 cm
Hauteur : 11,4 pouces/29 cm
Epaisseur : 5,5 pouces/14 cm
Hauteur de la poignée : 8,26 pouces/21 cm

Taille L :
Largeur du bas : 19,1 pouces/46 cm
Hauteur : 13,8 pouces/33 cm
Epaisseur : 7,1 pouces/17 cm
Hauteur de la poignée : 8,26 pouces/21 cm

🎨 Couleur du sac : rouge, noir, kaki, vert, rose, bleu
Sac noir par défaut 2170 fils
Sac rouge par défaut 2314 fil
Sac kaki défaut 3401 fil
Fil vert par défaut 3226
Sac rose par défaut 2258 fils
Sac bleu par défaut 3625 fils

* Toutes les données sont mesurées manuellement à titre indicatif, il y a une erreur de 1 à 3 cm
* La doublure du sac est en polyester, veuillez ne pas passer de commande si cela vous dérange

* La hauteur et la largeur du texte personnalisé étant limitées, si le texte n'est pas long (en référence à la largeur) mais que la hauteur dépasse la limite lors de l'utilisation de la police 9, l'ensemble du texte sera réduit. La police 9 sera plus petite si elle est appliquée à certaines expressions (commençant par J ou des lettres telles que C/S/L, se terminant par y/j/g/p/q ou des mots au milieu). Si cela vous dérange, veuillez ne pas choisir la police 9.

* Le texte et la couleur ne peuvent pas être modifiés après avoir passé la commande, veuillez confirmer clairement avant le paiement

Pour ce qui est de la personnalisation, nous adapterons le texte à vos notes, veuillez donc faire attention à l'utilisation des majuscules. Si le contenu personnalisé n'est pas fourni, nous devrons vous contacter pour confirmation, ce qui peut retarder la production. Veuillez vérifier vos notes de personnalisation à la caisse, merci !

Pour les commandes urgentes :
Si vous avez besoin d'une commande urgente (quelle que soit la date de livraison estimée), veuillez nous contacter immédiatement après avoir passé votre commande. Nous vous fournirons une estimation du temps et organiserons la production en conséquence. Notez qu'une fois la personnalisation commencée, les commandes ne peuvent pas être annulées. La production standard prend 5 à 7 jours et la livraison prend généralement 2 à 3 semaines. Pour toute question, n'hésitez pas à nous contacter, nous sommes là pour vous aider !

Prêt à créer un souvenir qu'ils chériront ? Ajouter au panier maintenant ! ??
En savoir plus sur cet article",
